<?xml version="1.0" encoding="utf-8" ?>
<Datatable xmlns:xsi="http://www.w3.org/2001/XMLSchema-instance" xmlns:xsd="http://www.w3.org/2001/XMLSchema" xsi:noNamespaceSchemaLocation="../Schemas/LawDefinition.xsd">



   <!-- removed -->
   <LawDefinition Name="LawP01L01UmbralChoir" SubCategory="LawPolitics04" ScoreProvider="EcologistLawEnacted" Duration="1" >
        <Politics Name="Politics04"/>
       <CustomCost ResourceName="EmpireEmpirePoint">Max(Round(Property(Context,@'../ClassEmpire/ClassSenate',LawActivationCostModifier) * 5),Round(Property(Context,@'../ClassEmpire/ClassSenate',LawActivationCostModifier) * (.2*Property(Context,@'../ClassEmpire',NetEmpireEmpirePoint))))</CustomCost>
        <LawEffectSimulation>
            <SimulationDescriptorReference Name="LawEffectP01L01UmbralChoir" />
        </LawEffectSimulation>
      <PathPrerequisite Flags="Prerequisite,Discard,Faction">../ClassEmpire,AffinityGameplayUmbralChoir</PathPrerequisite>
      <PathPrerequisite Flags="Prerequisite,Discard,Faction">../ClassEmpire,!AffinityGameplayUmbralChoir</PathPrerequisite>
        <PathPrerequisite Flags="Prerequisite,Discard,Government">ClassSenate,!GovernmentRepublic</PathPrerequisite>
        <PathPrerequisite Flags="Prerequisite,Discard" Inverted="true">../ClassEmpire,FactionTraitManualHomeSystem</PathPrerequisite>
        <SupportPrerequisite Flags="Prerequisite,Disable,Support" Politics="Politics04">1</SupportPrerequisite>
        <InterpreterPrerequisite Flags="Prerequisite,AdditionalUpkeep">(Property(Context,@'../ClassEmpire',NetEmpireEmpirePoint) + Property(Context,@'../ClassEmpire',EmpireEmpirePointStock)) ge 2 * Property(Context, @'../ClassEmpire', Population)</InterpreterPrerequisite>
        <PoliticsExperiencePrerequisite Flags="Prerequisite,Disable,Experience" Politics="Politics04">0</PoliticsExperiencePrerequisite>
        <SimulationDescriptorReference Name="LawPolitics04"/>
        <SimulationDescriptorReference Name="LawUpkeepLevel1"/>
    </LawDefinition>

   <!-- removed -->  
    <LawDefinition Name="LawP01L01UmbralChoirRepublic" SubCategory="LawPolitics04" ScoreProvider="EcologistLawEnacted" Duration="1" >
        <Politics Name="Politics04"/>
        <CustomCost ResourceName="EmpireEmpirePoint">Max(Round(Property(Context,@'../ClassEmpire/ClassSenate',LawActivationCostModifier) * 5),Round(Property(Context,@'../ClassEmpire/ClassSenate',LawActivationCostModifier) * (.2*Property(Context,@'../ClassEmpire',NetEmpireEmpirePoint))))</CustomCost>
        <LawEffectSimulation>
            <SimulationDescriptorReference Name="LawEffectP01L01UmbralChoirRepublic" />
        </LawEffectSimulation>
       <PathPrerequisite Flags="Prerequisite,Discard,Faction">../ClassEmpire,AffinityGameplayUmbralChoir</PathPrerequisite>
       <PathPrerequisite Flags="Prerequisite,Discard,Faction">../ClassEmpire,!AffinityGameplayUmbralChoir</PathPrerequisite>
        <PathPrerequisite Flags="Prerequisite,Discard,Government">ClassSenate,GovernmentRepublic</PathPrerequisite>
        <PathPrerequisite Flags="Prerequisite,Discard" Inverted="true">../ClassEmpire,FactionTraitManualHomeSystem</PathPrerequisite>
        <SupportPrerequisite Flags="Prerequisite,Disable,Support" Politics="Politics04">1</SupportPrerequisite>
        <InterpreterPrerequisite Flags="Prerequisite,AdditionalUpkeep">(Property(Context,@'../ClassEmpire',NetEmpireEmpirePoint) + Property(Context,@'../ClassEmpire',EmpireEmpirePointStock)) ge 2 * Property(Context, @'../ClassEmpire', Population)</InterpreterPrerequisite>
        <PoliticsExperiencePrerequisite Flags="Prerequisite,Disable,Experience" Politics="Politics04">0</PoliticsExperiencePrerequisite>
        <SimulationDescriptorReference Name="LawPolitics04"/>
        <SimulationDescriptorReference Name="LawUpkeepLevel1"/>
    </LawDefinition>

   <LawDefinition Name="LawP04L01UmbralChoir" SubCategory="LawPolitics04" ScoreProvider="EcologistLawEnacted" Duration="1" >
      <Politics Name="Politics04"/>
      <CustomCost ResourceName="EmpireEmpirePoint">Max(Round(Property(Context,@'../ClassEmpire/ClassSenate',LawActivationCostModifier) * 5),Round(Property(Context,@'../ClassEmpire/ClassSenate',LawActivationCostModifier) * (.2*Property(Context,@'../ClassEmpire',NetEmpireEmpirePoint))))</CustomCost>
      <LawEffectSimulation>
         <SimulationDescriptorReference Name="LawEffectP01L01UmbralChoir" />
      </LawEffectSimulation>
      <PathPrerequisite Flags="Prerequisite,Discard,Faction">../ClassEmpire,AffinityGameplayUmbralChoir</PathPrerequisite>
      <PathPrerequisite Flags="Prerequisite,Discard,Government">ClassSenate,!GovernmentRepublic</PathPrerequisite>
      <PathPrerequisite Flags="Prerequisite,Discard" Inverted="true">../ClassEmpire,FactionTraitManualHomeSystem</PathPrerequisite>
      <SupportPrerequisite Flags="Prerequisite,Disable,Support" Politics="Politics04">1</SupportPrerequisite>
      <InterpreterPrerequisite Flags="Prerequisite,AdditionalUpkeep">(Property(Context,@'../ClassEmpire',NetEmpireEmpirePoint) + Property(Context,@'../ClassEmpire',EmpireEmpirePointStock)) ge 2 * Property(Context, @'../ClassEmpire', Population)</InterpreterPrerequisite>
      <PoliticsExperiencePrerequisite Flags="Prerequisite,Disable,Experience" Politics="Politics04">0</PoliticsExperiencePrerequisite>
      <SimulationDescriptorReference Name="LawPolitics04"/>
      <SimulationDescriptorReference Name="LawUpkeepLevel1"/>
   </LawDefinition>

   <LawDefinition Name="LawP04L01UmbralChoirRepublic" SubCategory="LawPolitics04" ScoreProvider="EcologistLawEnacted" Duration="1" >
      <Politics Name="Politics04"/>
      <CustomCost ResourceName="EmpireEmpirePoint">Max(Round(Property(Context,@'../ClassEmpire/ClassSenate',LawActivationCostModifier) * 5),Round(Property(Context,@'../ClassEmpire/ClassSenate',LawActivationCostModifier) * (.2*Property(Context,@'../ClassEmpire',NetEmpireEmpirePoint))))</CustomCost>
      <LawEffectSimulation>
         <SimulationDescriptorReference Name="LawEffectP01L01UmbralChoirRepublic" />
      </LawEffectSimulation>
      <PathPrerequisite Flags="Prerequisite,Discard,Faction">../ClassEmpire,AffinityGameplayUmbralChoir</PathPrerequisite>
      <PathPrerequisite Flags="Prerequisite,Discard,Government">ClassSenate,GovernmentRepublic</PathPrerequisite>
      <PathPrerequisite Flags="Prerequisite,Discard" Inverted="true">../ClassEmpire,FactionTraitManualHomeSystem</PathPrerequisite>
      <SupportPrerequisite Flags="Prerequisite,Disable,Support" Politics="Politics04">1</SupportPrerequisite>
      <InterpreterPrerequisite Flags="Prerequisite,AdditionalUpkeep">(Property(Context,@'../ClassEmpire',NetEmpireEmpirePoint) + Property(Context,@'../ClassEmpire',EmpireEmpirePointStock)) ge 2 * Property(Context, @'../ClassEmpire', Population)</InterpreterPrerequisite>
      <PoliticsExperiencePrerequisite Flags="Prerequisite,Disable,Experience" Politics="Politics04">0</PoliticsExperiencePrerequisite>
      <SimulationDescriptorReference Name="LawPolitics04"/>
      <SimulationDescriptorReference Name="LawUpkeepLevel1"/>
   </LawDefinition>
  

</Datatable>